{
  "$schema": "./schemas/openai-mcp-profile.schema.json",
  "_generated": "Generated by scripts/gen-openai-profile.mjs from manifest.json and config/integrations.example.json -- do not edit by hand.",
  "name": "realityengine-openai-mcp-profile",
  "version": "1.1.0",
  "manifest": {
    "name": "realityengine",
    "version": "1.1.0",
    "toolCount": 20
  },
  "profiles": {
    "local": {
      "description": "Local OpenAI Responses API MCP profile for the RealityEngine Streamable HTTP gateway.",
      "environment": {
        "RE_MCP_ALLOW_MUTATION": "false",
        "RE_MCP_ALLOWED_TOOLS": "",
        "RE_MCP_HTTP_HOST": "127.0.0.1",
        "RE_MCP_HTTP_PORT": "7331"
      },
      "tools": [
        {
          "type": "mcp",
          "server_label": "realityengine-local",
          "server_description": "RealityEngine MCP gateway exposing RE/PE read tools and policy-gated provider completion/dispatch tools.",
          "server_url": "http://localhost:7331/mcp",
          "allowed_tools": [
            "dispatch.read_ledger",
            "dispatch.read_record",
            "dispatch.update_record",
            "integrations.completion",
            "integrations.dispatch_ollama",
            "integrations.dispatch_openai",
            "integrations.dispatch_provider",
            "pe.enqueue_push",
            "pe.integrations_status",
            "pe.list_sources",
            "pe.push_signal",
            "pe.read_state",
            "pe.sensor_push",
            "pe.triggers_status",
            "re.list_machines",
            "re.list_sequences",
            "re.machine_graph",
            "re.perceive",
            "re.read_machine",
            "re.read_state"
          ],
          "require_approval": {
            "always": {
              "tool_names": [
                "dispatch.update_record",
                "integrations.completion",
                "integrations.dispatch_ollama",
                "integrations.dispatch_openai",
                "integrations.dispatch_provider",
                "pe.enqueue_push",
                "pe.push_signal",
                "pe.sensor_push",
                "re.perceive"
              ]
            },
            "never": {
              "tool_names": [
                "dispatch.read_ledger",
                "dispatch.read_record",
                "pe.integrations_status",
                "pe.list_sources",
                "pe.read_state",
                "pe.triggers_status",
                "re.list_machines",
                "re.list_sequences",
                "re.machine_graph",
                "re.read_machine",
                "re.read_state"
              ]
            }
          },
          "defer_loading": true
        }
      ]
    },
    "secureTunnel": {
      "description": "Remote OpenAI Responses API MCP profile for a secured tunnel in front of the same gateway.",
      "environment": {
        "RE_MCP_HTTP_HOST": "127.0.0.1",
        "RE_MCP_HTTP_PORT": "7331",
        "RE_MCP_BEARER_TOKEN": "${RE_MCP_BEARER_TOKEN}"
      },
      "tools": [
        {
          "type": "mcp",
          "server_label": "realityengine-secure-tunnel",
          "server_description": "RealityEngine MCP gateway exposing RE/PE read tools and policy-gated provider completion/dispatch tools.",
          "server_url": "https://REPLACE_WITH_SECURE_MCP_TUNNEL_HOST/mcp",
          "allowed_tools": [
            "dispatch.read_ledger",
            "dispatch.read_record",
            "dispatch.update_record",
            "integrations.completion",
            "integrations.dispatch_ollama",
            "integrations.dispatch_openai",
            "integrations.dispatch_provider",
            "pe.enqueue_push",
            "pe.integrations_status",
            "pe.list_sources",
            "pe.push_signal",
            "pe.read_state",
            "pe.sensor_push",
            "pe.triggers_status",
            "re.list_machines",
            "re.list_sequences",
            "re.machine_graph",
            "re.perceive",
            "re.read_machine",
            "re.read_state"
          ],
          "require_approval": {
            "always": {
              "tool_names": [
                "dispatch.update_record",
                "integrations.completion",
                "integrations.dispatch_ollama",
                "integrations.dispatch_openai",
                "integrations.dispatch_provider",
                "pe.enqueue_push",
                "pe.push_signal",
                "pe.sensor_push",
                "re.perceive"
              ]
            },
            "never": {
              "tool_names": [
                "dispatch.read_ledger",
                "dispatch.read_record",
                "pe.integrations_status",
                "pe.list_sources",
                "pe.read_state",
                "pe.triggers_status",
                "re.list_machines",
                "re.list_sequences",
                "re.machine_graph",
                "re.read_machine",
                "re.read_state"
              ]
            }
          },
          "defer_loading": true,
          "headers": {
            "Authorization": "Bearer ${RE_MCP_BEARER_TOKEN}"
          }
        }
      ]
    }
  }
}
